id,company,author,rating,comment,date,top_critic,game_id
5d8672d093765d6778754b73,Metro GameCentral,Alex Hudson,60.0,"It doesn't really do a lot more than what Elite achieved over 30 years ago, but this is a fun and accessible, if rather repetitive, space trading game.",2015-10-22T04:00:00.000Z,True,73f7ee3f9e5540ff963573b9c3b08744
5d8672d193765d6778754c84,TechRaptor,Robert N. Adams,95.0,"Rebel Galaxy is nearly perfect in every way. It provides the perfect mix of player choice, balance, and challenge for fans of space combat games who don't mind the lack of 3D flight.",2015-10-20T04:00:00.000Z,True,73f7ee3f9e5540ff963573b9c3b08744
5d8672d193765d6778754c22,MMORPG.com,William Murphy,80.0,"Rebel Galaxy may seem like something deep and hard to grasp, but as soon as you figure out the combat the rest of the game's easy to learn bit difficult to master systems become just layers on a delicious cake. Recommended.",2015-10-20T04:00:00.000Z,True,73f7ee3f9e5540ff963573b9c3b08744
5d8672d093765d6778754b79,Eurogamer,Paul Dean,75.0,Rebel Galaxy's rendition of space is full of possibilities - but they're all a little too dull and repetitive for it to really work.,2015-10-20T04:00:00.000Z,True,73f7ee3f9e5540ff963573b9c3b08744
5d8672d193765d6778754c87,Wccftech,Chris Wray,78.0,"With a vast world with a huge amount to do, set in a space western and an outstanding soundtrack to accompany it, Rebel Galaxy has a simple but engaging and visually spectacular combat system. Rebel Galaxy has more than enough to keep you engaged, though best played in small doses.",2015-10-19T04:00:00.000Z,True,73f7ee3f9e5540ff963573b9c3b08744
5d8672d093765d6778754b80,Softpedia,Andrei Dumitrescu,90.0,"Many gamers will love or hate the game based on how they feel about the two dimensional combat and the unique way it challenges players to be aware of movement, shields, disruptor, boost and weapon fire at the same time.",2015-10-19T04:00:00.000Z,True,73f7ee3f9e5540ff963573b9c3b08744
5d8672d093765d6778754b85,High-Def Digest,Levi van Tine,80.0,"'Rebel Galaxy' comes out of left field - an adept and fun space sim from two developers who have spent decades working on RPGs. If you have ever wanted to fly a capital ship of your very own and blow up pirates (or become one), your opportunity has arrived at last.",2015-10-18T04:00:00.000Z,True,73f7ee3f9e5540ff963573b9c3b08744
5d8672d193765d6778754c0e,IGN,Dan Stapleton,80.0,Cinematic starship combat and a (final) frontier atmosphere give Rebel Galaxy a great hook.,2015-10-16T04:00:00.000Z,True,73f7ee3f9e5540ff963573b9c3b08744
5e909096bdf729557ef48157,Cubed3,Eric Ace,80.0,"Jackbox Party 6 has some great mini-games, and some decent ones. Far more adult oriented, its major downside is the higher degree of involvement and lesser payoff for some of the games. That being said, every single one in here is good, and some of them get some serious group laughs. Not as beginner friendly as some others, even a moderately committed group of people will find great fun somewhere in the five different games here.",2020-04-10T00:00:00.000Z,True,101424838a68468d8da192f3644e61d4
5de847bcad4f81777e1f4a4b,Game Rant,Dalton Cooper,80.0,"The Jackbox Party Pack 6 has one weak mini-game, but otherwise it's perhaps the most well-rounded collection of party games yet.",2019-12-04T00:00:00.000Z,True,101424838a68468d8da192f3644e61d4
5dd7cbef66e2226fc00642fd,The Digital Fix,Jonny Foster,80.0,"Jackbox Party Pack 6 is an enjoyable set of party games, albeit one that probably needs an audience at 16-35 years old to get the most out of it. It doesn't have the raw humour or appeal that, say, Party Packs 2 and 3 embody, but it's still a solid title in its own right.",2019-11-22T00:00:00.000Z,True,101424838a68468d8da192f3644e61d4
5debddd5ad4f81777e1f504c,Chalgyr's Game Room,Pierre-Yves Lanthier,85.0,"So overall, JackBox Games Party Pack 6 is a great addition to the series with plenty of new additions to suit multiple moods to a night amongst family and / or friends. From Murder Trivia making a return to new cheesy things like Joke Boat, and it stands alone just as easily as it stands alongside the other five party boxes.",2019-11-20T00:00:00.000Z,False,101424838a68468d8da192f3644e61d4
5e1efdbd63796013cde61f67,CGMagazine,Jed Whitaker,60.0,"The Jackbox Party Pack 6 brings with it four new games and the sequel to Trivia Murder Party. It's more polished than the previous releases on launch, but none of the new games are particularly great.",2019-11-19T00:00:00.000Z,True,101424838a68468d8da192f3644e61d4
5de5bf6cad4f81777e1f4139,Game Freaks 365,Kyle Bell,60.0,"If you haven’t played a Jackbox Party Pack game before, all of these games are going to feel relatively fresh. Some are better than others, but you’ll at least get a few laughs out of it.",2019-11-11T00:00:00.000Z,False,101424838a68468d8da192f3644e61d4
5dc95bd33496c41f3bb5c3fe,Jump Dash Roll,Rob Kershaw,60.0,"An uneven selection of party titles which, while polished, doesn't have a killer game in its bundle to make it a must-have purchase.",2019-11-11T00:00:00.000Z,True,101424838a68468d8da192f3644e61d4
5dc1b38a7f2bb94cfe4bdd6b,Screen Rant,Ty Sheedlo,80.0,"With the highly-awaited sequel in Trivia Murder Party 2 and a surprise hit in Push the Button, Jackbox Party Pack 6 is near-perfect party-game heaven.",2019-11-05T00:00:00.000Z,True,101424838a68468d8da192f3644e61d4
5db9cb37c55ae12d47d2b286,GameSpace,Damien Gula,80.0,"Jackbox games have always had a very specific brand of humor that is just plain weird. I don't mean that in a bad way; I mean that in the wacky, endearing definition of the word. While it is this off-the-way, non-sequitur humor that drives it, but the accessibility of Jackbox Party Pack 6 has something for everyone across a broad audience.",2019-10-30T00:00:00.000Z,True,101424838a68468d8da192f3644e61d4
5db3644964f5787ec013479e,Destructoid,Kevin McClusky,80.0,"The Jackbox Party Pack 6 continues Jackbox's streak of funny, low-key party games without deviating much from their established formula. If you're looking for something fun to do with a group for a couple of hours, you can't go wrong with one of the Jackbox Party Packs. There aren't really any experimental games like Zeeple Dome from last year's collection, but there's plenty worth playing in this year's Pack.",2019-10-25T00:00:00.000Z,True,101424838a68468d8da192f3644e61d4
5db2210a64f5787ec0134552,GameSpew,Becca Smith,70.0,"Like most Jackbox Party Packs, Jackbox Party Pack 6 has a couple of fantastic games, and a couple that don’t quite hit the mark.",2019-10-24T00:00:00.000Z,True,101424838a68468d8da192f3644e61d4
5db1f87464f5787ec0134470,Nintendo Times,Craig Majaski,55.0,"MEDIOCRE - It pains me to score The Jackbox Party Pack 6 so low because I’m truly a huge fan of the series. Normally at least two or three of the five included games are a blast, but this time around only one (Trivia Murder Party 2) really delivered the goods. Some may find a few more of the included games worth their time, but overall I can’t help but be disappointed.",2019-10-24T00:00:00.000Z,False,101424838a68468d8da192f3644e61d4
5db0b7b064f5787ec01342e0,PlayStation LifeStyle,Jenni Lada,75.0,"It’ll be a fine pack to have stored away for all of the gatherings that will surely come as the holidays approach, though surely some people will be sad that none of the games let them really show off their drawing skills.",2019-10-23T00:00:00.000Z,True,101424838a68468d8da192f3644e61d4
5dabc2a4f0ce737777184867,Video Chums,A.J. Maciejewski,61.0,"After playing this latest offering from Jackbox Games, I hope they go back to the drawing board for next year's collection.",2019-10-19T00:00:00.000Z,True,101424838a68468d8da192f3644e61d4
5dab836c5600ae62dfe10483,GamingTrend,Sean Anthony,95.0,"Jackbox rarely disappoints and The Jackbox Party Pack 6 proves that the series is just as entertaining as it ever was. The return of Trivia Murder Party is welcome, and the four new games all bring something unique to the table. If you've ever enjoyed a Jackbox title before, you'll absolutely want to pick this one up.",2019-10-19T00:00:00.000Z,True,101424838a68468d8da192f3644e61d4
5dab17b95600ae62dfe1045c,TechRaptor,Andrew Stretch,70.0,"The Jackbox Party Pack 6 comes in with some great games, and a few really forgettable ones. Push the Button does well as a complete departure from the traditional Jackbox Style and Trivia Murder Party 2 and Role Models are a great laugh for a party.",2019-10-19T00:00:00.000Z,True,101424838a68468d8da192f3644e61d4
5daa786f5600ae62dfe10438,NintendoWorldReport,Jordan Rudek,60.0,"Ultimately, Jackbox Party Pack 6 feels like a letdown. It's missing both You Don't Know Jack and a game where you have the chance to draw, and those two experiences are ones that my group of friends has always very much looked forward to. If you loved Trivia Murder Party or aspire to have your own stand-up routine, Jackbox 6 might be worth your time, but you're probably better off looking into one of the earlier collections that seem to be regularly going on sale.",2019-10-18T00:00:00.000Z,True,101424838a68468d8da192f3644e61d4
5daffb6934f2907a2bb55f3f,PC Invasion,Stefan Bahruth,80.0,"The Jackbox Party Pack 6 brings excellent new additions to your party game rotation with Push The Button and Dictionarium, but falls flat with Joke Boat.",2019-10-17T00:00:00.000Z,True,101424838a68468d8da192f3644e61d4
5da899efc7c36e55d01ede8c,DualShockers,Chris Compendio,80.0,"Despite being built from previously-used parts, The Jackbox Party Pack 6 is still one of the more solid and consistent collections.",2019-10-17T00:00:00.000Z,True,101424838a68468d8da192f3644e61d4
6007f0840f8974118c9388da,Nintendojo,Achi Ikeda,83.0,"Though it isn’t the perfect space game, it’s a pretty darn good one. It gives you so much to think about, but it never feels overwhelming thanks to the three difficulty settings. A casual player will have a great time with the Explorer setting, whereas fans of resource management games who love to strategize will enjoy the Veteran setting. The game is also educational and a great way to get newcomers interested in space.",2021-01-20T00:00:00.000Z,True,13ef3df5b23f4491b7d7ab8bceb0779e
60007e310f8974118c93838a,NintendoWorldReport,Joel DeWitte,65.0,"Its systems are light enough to not be overwhelming, and even if they become too much for you, a well-defined tutorial does a good job of holding your hand as you get a grasp of things.  The core problem and one that brings this down from a great game to simply fine is just how little control you get over actual launches.  If there was more agency in that side of things, then this would be a no-brainer recommendation.",2021-01-14T00:00:00.000Z,True,13ef3df5b23f4491b7d7ab8bceb0779e
5fe2101a8add7352830ff3f9,SECTOR.sk,Branislav Kohút,75.0,Very realistic game about history and near future of cosmonautic. Amusing expeditions in space.,2020-12-22T00:00:00.000Z,True,13ef3df5b23f4491b7d7ab8bceb0779e
5fe0f51c8add7352830ff348,Generación Xbox,Gabriel Fuentes,81.0,"Mars Horizon fulfills with originality a mission almost as difficult as sending a manned mission to outer space, which is to transform the management of a space program into something attractive and fun for a large number of people, even those who are not very into the subject . The most negative aspect that I see, is that even today this type of management simulator, especially with this theme, falls into a very niche audience and perhaps does not become as massive as it should, judging by its quality.",2020-12-19T00:00:00.000Z,True,13ef3df5b23f4491b7d7ab8bceb0779e
5fcb9036038871749d417c9f,PlayStation Universe,Alan Strawbridge,80.0,"A space agency simulator which overcomes its PC roots and primitive presentation to become a highly addictive and original strategy game. Packed with space facts and sprinklings of humour, Mars Horizon is a joy to dip into for both young and old and your thumbs can rest while your brain takes over.",2020-12-05T00:00:00.000Z,True,13ef3df5b23f4491b7d7ab8bceb0779e
5fc6a279038871749d417314,Hey Poor Player,Heather Johnson,70.0,"I’ve been so tough on Mars Horizon. Know that I’m sorry about that. I was more deeply invested in getting to Mars than I’ve been in a ton of other games this year, so know that it comes from a place of adoration and a desire to see some quality of life improvements to a phenomenal game. If you love space, get this game. If you want to learn about the processes behind space exploration, get this game. I genuinely hope the developers make some of these improvements, but even if they don’t, Mars Horizon has been a joyride I won’t soon forget.",2020-11-26T00:00:00.000Z,False,13ef3df5b23f4491b7d7ab8bceb0779e
5fbea71e038871749d416864,Softpedia,Cosmin Vasile,70.0,"In the end, Mars Horizon turns out to be quite a simple game, despite the initial complex impression. Because of the repetitive gameplay, although the game has replay value, most players will be rather bothered by the end they finish the race to Mars and will not be tempted to try again. It is worth a try if you are a fan of space exploration, but curb your enthusiasm regarding the fun the game can provide.",2020-11-25T00:00:00.000Z,True,13ef3df5b23f4491b7d7ab8bceb0779e
5fc3ed8e038871749d416d48,Gamer's Palace,Beatrice Vogt,55.0,"I had a lot of fun researching for the next big thing in Mars Horizon, but a lot less due to all the technical issues with the PS4 version.",2020-11-22T00:00:00.000Z,False,13ef3df5b23f4491b7d7ab8bceb0779e
5fb7dac7038871749d415ddf,PCGamesN,Joe Robinson,80.0,A fun management game about running a space program and shooting for the stars that sacrifices some of the visual wonder of space travel in order to remain accessible.,2020-11-20T00:00:00.000Z,True,13ef3df5b23f4491b7d7ab8bceb0779e
5fb573dd038871749d4159d7,GameSpew,Chris Mc,70.0,"You’ll grind your teeth when you’re the last man on the moon, but the more you persist, the more Mars Horizon pulls you in. If you’ve got even the slightest interest in the Space Race, this is one of the most engaging ways to experience it.",2020-11-18T00:00:00.000Z,True,13ef3df5b23f4491b7d7ab8bceb0779e
5fb6e59c038871749d415c92,But Why Tho?,Matt Donahue,90.0,"Mars Horizon is a game that anyone who ever wanted to be an astronaut dreamed of having. The ambient music sets the tone for players as they set off the uncover the Solar System. This is by far one of the hardest games I’ve had to review in that on the surface this game looks so simple and monotonous, but as you break it down you get to unravel all the challenges and complexities it has to offer.",2020-11-17T00:00:00.000Z,False,13ef3df5b23f4491b7d7ab8bceb0779e
603638b9529d50e69fa0f13b,GameBlast,Farley Santos,80.0,"The Solitaire Conspiracy uses the espionage theme to modernize the Solitaire game. The addition of special skills brings strategic aspects, resulting in agile and interesting matches. In essence it is a Solitaire variation and sometimes the simplicity stands out, but different modes, such as Campaign Plus, which resembles puzzles, and the frantic Countdown, which also requires quick reflexes, help to bring diversity. In addition to the updated mechanics, it is difficult to not be involved by the atmosphere created with stylish art direction and the use of neon colors. The campaign and its scenes with video performances are very engaging; it's just a shame that the plot is quite predictable. In the end, The Solitaire Conspiracy is a remarkable and addictive experience.",2021-02-24T00:00:00.000Z,False,940d35d57025450eb997b571abd054d1
5f92e93dfce0972e4e5f867a,Saving Content,Evan Rowe,80.0,"The Solitaire Conspiracy almost shouldn’t work, but it’s an example of that rare bit of alchemy that manages to fuse together two things that have no business occupying the same space into a shiny, exciting new thing that’s a joy to behold. You could certainly break down the game into its distinctive components, but there is a throughline that runs through all of it that doesn’t just tie those elements together, but makes them feel like they belong in this place with one another. It’s not necessarily a revolution in gaming, but the story is cheeky and fun, and the Solitaire itself is fun enough that you’ll want to keep it installed to continue playing well after the credits roll.",2020-10-23T00:00:00.000Z,False,940d35d57025450eb997b571abd054d1
5f871aa1fce0972e4e5f7260,VideoGamer,Josh Wise,60.0,"It was clearly forged from a love of Solitaire, and even its failures feel like restless, riffled expressions of that love.",2020-10-14T00:00:00.000Z,True,940d35d57025450eb997b571abd054d1
5f85aa17fce0972e4e5f6fd6,GameSpace,Damien Gula,90.0,"What do you get when you add espionage and intrigue to the ubiquitous game found in nursing homes and every Windows decide known to mankind, then drop it into a carefully crafted, existing science fiction world? You get The Solitaire Conspiracy.",2020-10-13T00:00:00.000Z,True,940d35d57025450eb997b571abd054d1
5f7d70413e66016bf9ecc254,IGN Italy,Damaso Scibetta,65.0,"After two beautiful shorts, Bithell Games returns with a new take in the solitaires world. The Solitaire Conspiracy, unfortunately, doesn't fulfil its promises: the strategic part of the card game is poor and the story is far worse than the average Bithell story. The core gameplay is ok for a three hours game, but struggles to hold the replayability for too long.",2020-10-07T00:00:00.000Z,True,940d35d57025450eb997b571abd054d1
5f7cd4b83e66016bf9ecc201,FingerGuns,Sean Davies,80.0,"If you’ve never played a solitaire video game, The Solitaire Conspiracy is the perfect gateway into them. Bithell Games have created an accessible yet deeply strategic twist on the classic card game that includes an espionage narrative delivered via FMV’s featuring famous faces. There’s some ludonarrative dissonance between the drama of story told and the relative calmness of the game play but it does little to spoil one of the best this genre has to offer.",2020-10-06T00:00:00.000Z,False,940d35d57025450eb997b571abd054d1
5f7c87a2839d422425c7e552,GameSpew,Kim Snaith,70.0,"I applaud Bithell Games’ efforts to make a classic card game something more. There’s no denying its presentation is compelling, even if the story may feel rather unnecessary. But regardless of how you feel about the over-the-top dramatics, there’s an excellent game at the core of The Solitaire Conspiracy. Its Countdown and Skirmish modes are something that players will find themselves going back to time and again – if only for a welcome change from Freecell or Spider Solitaire.",2020-10-06T00:00:00.000Z,True,940d35d57025450eb997b571abd054d1
5f7c8364839d422425c7e547,GameSpot,Andrew King,70.0,The Solitaire Conspiracy deals out excellent solitaire with a weak layer of FMV window dressing.,2020-10-06T00:00:00.000Z,True,940d35d57025450eb997b571abd054d1
5f7c835f839d422425c7e544,Critical Hit,Darryn Bonthuys,80.0,"The Solitaire Conspiracy is one of this year's most surprisingly addictive games, a tense showdown amongst spies using nothing other than your own wits and a few card tricks up your sleeve to deliver a quick punch of strategy.",2020-10-06T00:00:00.000Z,True,940d35d57025450eb997b571abd054d1
5f7c835a839d422425c7e541,God is a Geek,Chris White,80.0,"Whilst it is only solitaire, Bithell Games has managed to put a fresh take on an old classic. The Solitaire Conspiracy is addictive, and it oozes style in every game.",2020-10-06T00:00:00.000Z,True,940d35d57025450eb997b571abd054d1
5f7c8354839d422425c7e53e,DualShockers,Michael Ruiz,80.0,Bithell Games brings another quality short experience with The Solitaire Conspiracy.,2020-10-06T00:00:00.000Z,True,940d35d57025450eb997b571abd054d1
62c45dc10bfe2deada18c25d,ZTGD,Ken McKown,75.0,"The Shadowrun Trilogy may be dated, but it is a worthy game to check out for people who enjoy turn-based combat. The fact that it is available on Game Pass also makes the barrier to entry much easier. This is also a beefy combination of games to get through with each one offering up their own unique setting and narrative. I am not the biggest fan of these types of games but Shadowrun Returns delivers on all fronts on what it sets out to do making it easy to recommend to just about anyone.",2022-07-05T00:00:00.000Z,True,4127c2cc818244ddb3003626f6687531
62c436b20bfe2deada18c169,WayTooManyGames,Thomas Medina,85.0,"The Shadowrun Trilogy is for everyone, and I’m glad it can finally be played by everyone. These fast-paced incredibly linear games are the opposite of the sprawling unfocused experiences people expect from the genre. Very story and dialogue based, though the lack of voice acting might turn people off. But the truly unique settings, the blend of fantasy and sci-fi, alongside the fun and quick XCOM-esque combat make games that look, read, and play very well. They helped shepherd in today’s RPG renaissance, and are still high watermarks of what’s been accomplished during it.",2022-07-05T00:00:00.000Z,False,4127c2cc818244ddb3003626f6687531
62bb14880bfe2deada188490,MMORPG.com,Mitchell Gassner,80.0,"Harebrained Schemes has done an excellent job porting the Shadowrun Trilogy to consoles. I only tried the PlayStation 5 version, but I would expect to have the same experience on the PS4 or any of the Xbox consoles. As a primarily PC gamer, I must admit that the team did an excellent job of adapting the UI to support a controller and big-screen TV. I would even say it’s worth paying full price to get the console version over the PC version, which can be found at a discount. The only thing missing is an upgrade in performance. Maybe Harebrained Schemes is saving that for another foray into the Shadowrun universe.",2022-06-28T00:00:00.000Z,True,4127c2cc818244ddb3003626f6687531
62b20b740bfe2deada184636,Screen Rant,Cody Gravelle,80.0,"The collection's biggest strength, and the games' best selling points individually, all boil down to their wonderful cyberpunk storytelling. There isn't a weak link among the three, with each story feeling relevant today. The exploration of hopelessness in the face of technological power or the inequality among people born into different circumstances can, at times, be brutal, but Shadowrun is largely about those without agency reclaiming it for themselves and others - an inspirational story, especially now. For that reason alone, the games are well-worth engaging in - but the tactical combat is still a draw too, scratching the itch for challenging content with plenty of rewarding eureka moments for those willing to spend time within them. Shadowrun Trilogy: Console Edition is a worthy port and a thought-provoking collection, making it a high recommendation even in 2022.",2022-06-21T00:00:00.000Z,True,4127c2cc818244ddb3003626f6687531
62b20aea0bfe2deada184617,God is a Geek,Mick Fraser,80.0,"Shadowrun Trilogy has a ton of atmosphere, and if you're looking for a strong narrative RPG you could do a lot worse.",2022-06-21T00:00:00.000Z,True,4127c2cc818244ddb3003626f6687531
62b20ae70bfe2deada184607,Push Square,Robert Ramsey,70.0,"If you can stomach its rough exterior, Shadowrun Trilogy is an easy recommendation for RPG fans. The games' straightforward structure makes them approachable in ways that other tabletop-based titles on PlayStation aren't, and the role-playing options are engaging throughout. Combat could do with a bit more punch, and the technical issues are an annoyance, but there's a lot of value to this well written sci-fi-fantasy package.",2022-06-21T00:00:00.000Z,True,4127c2cc818244ddb3003626f6687531
62b20ae40bfe2deada1845fc,Nintendo Life,PJ O'Reilly,50.0,"The Shadowrun Trilogy is a superb trio of RPG classics that we were psyched to get stuck into all over again on Nintendo Switch. However, constant performance issues, including stuttering frame rates, long loading times, unresponsive and sticky controls, and a serious bug that freezes your game entirely at points, means that this is a series of ports we find it very difficult to recommend picking up as things currently stand at launch. Let's hope there's a significant patch on the way ASAP as these are games that deserve to be played by as many people as possible.",2022-06-21T00:00:00.000Z,True,4127c2cc818244ddb3003626f6687531
62b20adc0bfe2deada1845e4,PlayStation Universe,John-Paul Jones,80.0,"Though the technical presentation of the three games encompassed in the Shadowrun Trilogy is modest, each of them nonetheless provides an entertainingly told narrative wrapped up in an old-fashioned CRPG shell with involving, but not especially sophisticated turn-based combat. If you're after a whole lot of cyberpunk RPG goodness with a very unique cyberpunk setting, great world building and entertaining writing, then the Shadowrun Trilogy is just the fix that you need.",2022-06-21T00:00:00.000Z,True,4127c2cc818244ddb3003626f6687531
5f8c7b8efce0972e4e5f7ce5,God is a Geek,Nicola Ardron,70.0,"Little Big Workshop is an enjoyable entry in the management sim game. It features cute diorama style visuals, but has surprisingly deep systems to tinker with that will keep you focused and strategising for the best way to grow your factory.",2020-10-18T00:00:00.000Z,True,f826bb54e078491a8322938983197d18
5f8730bbfce0972e4e5f731f,Softpedia,Cosmin Vasile,60.0,"Still, the state of the game at launch remains inexcusable, and even after several patches, some major issues continue to plague the game's complex mechanics. If you have picked up Little Big Workshop right after release and got turned down by the technical issues, then wait for a few more patches and give it another chance. If you're considering the game, wait for a discount since Little Big Workshop might be fixed by then.",2020-10-14T00:00:00.000Z,True,f826bb54e078491a8322938983197d18
