id,company,author,rating,comment,date,top_critic,game_id
61b9cdd79e5c48c548d64e7f,ThisGenGaming,Justin Oneil,80.0,Fans of 3D platformers would do well not to overlook Demon Turf this year. The game’s visual style is unique and one of the best things about it but the platforming is equally as enjoyable.,2021-11-09T00:00:00.000Z,True,2ec6541c3d2a49ed869c1edbcd196a2b
618ad891e51c67ed243955b2,KeenGamer,Dakota Gordon,75.0,"Welcome to a world where platforming reigns! Demon Turf is an adventure with attitude, starring Beebz in her goal of taking down the Demon King and ruling over the domain. For those fond of the procedural jump and shoot method of travel, this is one not to miss.",2021-11-09T00:00:00.000Z,True,2ec6541c3d2a49ed869c1edbcd196a2b
618ab989df714ee8b3796215,GameGrin,Gary Sheppard,80.0,"A stylish throwback to a couple of decades ago, this platformer will appeal mainly to those who still miss the Dreamcast. A few niggles with the camera, a couple of minor bugs and some rather harsh difficulty spikes stop it from being a world-beater, but it's a solid piece of fun despite these small issues.",2021-11-09T00:00:00.000Z,True,2ec6541c3d2a49ed869c1edbcd196a2b
618d2993fd61a71c55a075ec,Geek Culture,Jake Su,76.0,"Looking fantastic and playing really well when it comes to platforming, Demon Turf is only let down by some curious combat and level design that mars the overall experience.",2021-11-08T00:00:00.000Z,False,2ec6541c3d2a49ed869c1edbcd196a2b
6188f81561198adb693d6974,God is a Geek,Lyle Carr,80.0,Demon Turf has a truly unique look and varied platforming gameplay,2021-11-08T00:00:00.000Z,True,2ec6541c3d2a49ed869c1edbcd196a2b
61854bae49c8e5ae95dacb2c,Niche Gamer,Fingal Belmont,70.0,"Demon Turf is the kind of game that wears its flaws on its sleeve, but everything in it comes together, and works that it becomes hard to not get sucked into the gameplay. Platforming and making progress is engrossing when the gameplay facilitates a rhythm to the level design and gaps; and this title revels in it.",2021-11-05T00:00:00.000Z,True,2ec6541c3d2a49ed869c1edbcd196a2b
61850c6b49c8e5ae95dacabe,LadiesGamers.com,James Luff,75.0,"Demon Turf is an entertaining demon filled adventure that I recommend to fans of 3D platformers. The game has a few niggles here and there. Combat felt loose and clunky, the platforming, while fun to control, had its moments of frustrations, particularly later in the game. Lastly, the side quests were just not very interesting. The developers clearly put a lot of love and effort into this release and it shows in volumes in the games design and brave attempt at trying something different from the usual platform formula. Not everything clicked with me but this is a trip into the demon realm I’m happy I took. For those that give it a chance, it’s hard not to find something to like in this demonic adventure. Demon Turf is an entertaining demon filled adventure that I recommend to fans of 3D platformers. The game has a few niggles here and there. Combat felt loose and clunky, the platforming, while fun to control, had its moments of frustrations, particularly later in the game. Lastly, the side quests were just not very interesting. The developers clearly put a lot of love and effort into this release and it shows in volumes in the games design and brave attempt at trying something different from the usual platform formula. Not everything clicked with me but this is a trip into the demon realm I’m happy I took. For those that give it a chance, it’s hard not to find something to like in this demonic adventure.",2021-11-05T00:00:00.000Z,False,2ec6541c3d2a49ed869c1edbcd196a2b
6197f95d0acdcc88f3475609,XboxEra,Győző Baki,78.0,"Revisiting areas further underlines another one of Demon Turf’s main problems: most levels feel relatively soulless, empty. As much as their visual style is generally on point, they still offer vast areas with very little happening, offering half a minute or more of uneventful walking. Entering the harder variant of a level fills it with dozens of collectible lollipops, some making the player go through even some of least exciting areas more than once.",2021-11-04T00:00:00.000Z,False,2ec6541c3d2a49ed869c1edbcd196a2b
618559b049c8e5ae95dacb38,GameBlast,Carlos França Júnior,50.0,"Demon Turf managed to bring together a number of interesting elements to be a good platform game, with well-structured stages, interesting abilities, a good replay factor and a charismatic character. However, problems in crucial aspects like the camera and character control, which are the main characteristics of the genre, greatly compromise the experience that the game could offer.",2021-11-04T00:00:00.000Z,False,2ec6541c3d2a49ed869c1edbcd196a2b
6183d1a7b99fe3a1fdb52158,Dragnix,Shaun Joy,88.0,"While it's definitely paying respect and has been influenced by those masterful games of the past: it's much more then that in the big scheme of things. See, what Demon Turf does is understand what made games of the past great and remixes it JUST slightly to feel fresh enough for the genre, while establishing its own identity in the process. While it stumbles here and there with small elements like the sound design and an overall lack of story punch, it makes up for in a game that will keep you coming back to finish all its content.",2021-11-04T00:00:00.000Z,False,2ec6541c3d2a49ed869c1edbcd196a2b
61839108b99fe3a1fdb52116,Hey Poor Player,Francis DiPersio,60.0,"While rough around the edges, Demon Turf provides plenty to keep fans of 3D platformers busy. After you beat an area’s boss, you’re able to visit more challenging versions of each stage. Additionally, there are tons of hidden cakes and cartridges to collect and photo challenges to complete in every area. That said, completionists will likely have a field day with what Demon Turf has to offer.

Demon Turf is a stylish and challenging platformer that brings some interesting ideas to the table. And while they may not all live up to their full potential, I can appreciate developer Fabraz taking a chance at shaking things up. If you’re a die-hard fan of the genre and are looking for something new to scratch that itch, Demon Turf probably won’t dethrone your favorite platformer. But that doesn’t mean there isn’t any fun to be had here. However, if you don’t fall into that category, you’ll probably want to consider hoisting your flag elsewhere.",2021-11-04T00:00:00.000Z,False,2ec6541c3d2a49ed869c1edbcd196a2b
61ae9761ae612c62fdd3357a,GGRecon,Tarran Stockton,70.0,"Demon Turf should be remembered fondly in a few years time as a solid platforming experience. The core of the gameplay loop is close to perfection, with the combat tirades and checkpoint system letting it down. Movement mechanics are tight and satisfying, along with well-designed levels that challenge the skills the player will have built up over the course of a playthrough. It’s got a loveable presentation thanks to its melding of 2D and 3D art, bright music, and the majority of its art design and aesthetics. It doesn’t do much to shake up the platformer or collect-a-thon, but it nails the important aspects of each one to craft a deviously fun romp through the Demon World.",2021-11-03T00:00:00.000Z,False,2ec6541c3d2a49ed869c1edbcd196a2b
618640a8eda567b8e54177ef,One More Game,Vincent Ternida,100.0,"Don’t let the retro exterior fool you. Demon Turf, for all its quirks, is a fun and challenging platformer to pick up if you like platformers like Psychonauts 2 and even if you’re looking for a replacement for Balan Wonderworld. Extra points if you like the 90s cartoon aesthetic and style and while I might find the story cringe-inducing, others may find it endearing.",2021-11-03T00:00:00.000Z,False,2ec6541c3d2a49ed869c1edbcd196a2b
618313c9be80c09de5fcbde2,PC Invasion,Andrew Farrell,80.0,"Lengthy and more than entertaining enough, Demon Turf has a few issues that irked me, but this is a very impressive 3D platformer that does a great job separating itself from the rest of the pack.",2021-11-03T00:00:00.000Z,True,2ec6541c3d2a49ed869c1edbcd196a2b
618313bebe80c09de5fcbde0,TheGamer,George Foster,80.0,"Although I’m sure completionists will find a lot to love here, I had the most fun with Demon Turf when I forgot about its myriad side quests, collectibles, and second visits to a level, and just ran through stages with my mastery of Beebz’s moves letting me fly through levels like I was Sonic and I’d finally learnt how to work in 3D. When Demon Turf is fast, it’s glorious, it’s just a shame it has some extra baggage stopping it from peeling out.",2021-11-03T00:00:00.000Z,True,2ec6541c3d2a49ed869c1edbcd196a2b
618313a4be80c09de5fcbdde,Screen Rant,Alex Santa Maria,70.0,"Demon Turf feels like a missed opportunity for its engaging, interesting new world to be catered to such a niche audience. Perhaps these lost levels can give way to an adventure with Beebz that's more up to speed with the general public, but for now, Demon Turf is well worth a try for hardcore platforming fans and difficult to recommend for those less fond of the genre.",2021-11-03T00:00:00.000Z,True,2ec6541c3d2a49ed869c1edbcd196a2b
61831374be80c09de5fcbddc,Destructoid,Zoey Handley,55.0,"It’s not a soulless game or one without a spark — there’s definitely a lot of love in the final product. It just seriously needed a few more sets of eyes on it to draw out its flaws. A lot of the things that vexed me most severely could be fixed with a few more passes of the floor buffer. Yet here we are, and Demon Turf doesn’t strike me as territory worth conquering.",2021-11-03T00:00:00.000Z,True,2ec6541c3d2a49ed869c1edbcd196a2b
61831171be80c09de5fcbdd3,Pure Xbox,Daniel Hollis,70.0,"Despite these flaws, Demon Turf is still an incredible platformer - one of the best in years. It's easy to learn but hard to master and is filled with content ranging from easy challenges to devilishly challenging gauntlets. With such a fine-tuned platforming experience, it's easy to overlook the boring combat and performance hiccups. While the latter will most likely be ironed out, the combat is here to stay, but if you can get past that hurdle, Demon Turf is a joyous throwback to the platformers of old.",2021-11-03T00:00:00.000Z,True,2ec6541c3d2a49ed869c1edbcd196a2b
618304fb2011779cb9674e66,Hardcore Gamer,Jordan Helm,70.0,"Despite its missed opportunities and ideas that don't gel with the core gameplay, developer Fabraz's foray into three-dimensional platforming remains a fun-if-flawed hearkening to the genre's glory days.",2021-11-03T00:00:00.000Z,True,2ec6541c3d2a49ed869c1edbcd196a2b
618302aa2011779cb9674e63,Video Chums,A.J. Maciejewski,83.0,"Demon Turf is one of the best 3D platformers in recent years and it even rivals recent AAA attempts at the genre. With spectacular gameplay, a huge campaign that's brimming with replay value, clever gadgets, and a gorgeous presentation; it's the whole package.",2021-11-03T00:00:00.000Z,True,2ec6541c3d2a49ed869c1edbcd196a2b
6182d5328412069004c4a3e8,COGconnected,Jaz Sagoo,68.0,"Demon Turf is a strange and peculiar game. At times, it nails its intention, delivering solid platforming sections, packed with ingenuity. However, you’ll often be let down by technical issues and odd design decisions that will ultimately hinder your experience. Although the game, doesn’t manage to stick the landing, it certainly has some memorable moments that will resonate with fans of classic 3D platformers.",2021-11-03T00:00:00.000Z,True,2ec6541c3d2a49ed869c1edbcd196a2b
6182b89b8412069004c4a378,FingerGuns,Sean Davies,80.0,"A slick, well designed game, Demon Turf is packed with personality, in part due to its 2D/3D hybrid visuals. Like a tour of the best the genre has to offer, this is a 3D platformer for those that grew up on them and fancy a hearty yet deeply rewarding challenge. It’s only let down by a handful of bugs which will hopefully get fixed via a patch.",2021-11-03T00:00:00.000Z,False,2ec6541c3d2a49ed869c1edbcd196a2b
6182b3a58412069004c4a373,GameSpew,Kim Snaith,70.0,"Ultimately, you’ll get most out of Demon Turf if you’re an ardent 3D platforming fan. There’s a lot to like here thanks to the range of skills and interesting upgrades up for grabs, and the levels provide a good amount of challenge. It can get a little repetitive though, so you’re better off keeping your play sessions short and sweet. But lean into its wacky sensibilities, and there’s fun to be had.",2021-11-03T00:00:00.000Z,True,2ec6541c3d2a49ed869c1edbcd196a2b
61829a208412069004c4a33e,Nintendo Life,Oliver Reynolds,80.0,"Demon Turf is a fantastic platformer that's held back from true greatness by sections of dull and repetitive combat. Push through this, however, and you've got a game that rewards daring and bravery, bolstered by wonderful platforming controls that let you string together incredible combos. The visuals are initially a bit jarring, but the character design really shines through and give it a timeless aesthetic. If you're a fan of 3D platformers from the 'golden' N64 era and beyond, this one is well worth a look.",2021-11-03T00:00:00.000Z,True,2ec6541c3d2a49ed869c1edbcd196a2b
6182999b8412069004c4a339,Cultured Vultures,Ashley Bates,85.0,"Demon Turf's few flaws do little to detract from an excellent 3D platforming experience that's worth checking out, whether you're a casual player or potential speedrunner.",2021-11-03T00:00:00.000Z,True,2ec6541c3d2a49ed869c1edbcd196a2b
618295c18412069004c4a335,Kakuchopurei,Jonathan Leo,80.0,"Demon Turf’s art style and graphics mask a deceptive, tough, tricky, and challenging platformer that offers bouts of fun, for about 8 to 10 hours tops.",2021-11-03T00:00:00.000Z,False,2ec6541c3d2a49ed869c1edbcd196a2b
618290708412069004c4a32f,VGC,Chris Scullion,60.0,"Demon Turf looks fantastic and its platforming mechanics are brilliantly satisfying, but it's let down by boring combat and occasionally confusing level design. It's still worth a look, but it's not the best.",2021-11-03T00:00:00.000Z,True,2ec6541c3d2a49ed869c1edbcd196a2b
61828faf8412069004c4a32c,NintendoWorldReport,John Rairdin,80.0,"The performance on Switch is largely great, but when it hits a snag it tends to do so at the worst possible time. But for the rest of the time it's a great looking, great sounding, and great-playing 3D platformer. This is one of those games where despite some flaws, you'll find yourself returning to old worlds to clean up every last collectible as you work your way up the demon ladder.",2021-11-03T00:00:00.000Z,True,2ec6541c3d2a49ed869c1edbcd196a2b
61828e748412069004c4a32a,Push Square,Stephen Tailby,70.0,"While the platforming is largely very good, the game does have its drawbacks. The camera doesn't always give you the best view, and fights can be frustrating with imprecise projectiles and a lack of combative options. The boss battles in particular can be irksome things. Even with its flaws, however, this is a game offering lots of personality and refreshing, clean platforming fun.",2021-11-03T00:00:00.000Z,True,2ec6541c3d2a49ed869c1edbcd196a2b
61828d7a8412069004c4a321,Nintendo Enthusiast,Jaimie Ditchfield,85.0,"Overall, Demon Turf is a solid 3D platformer on Nintendo Switch, with a ton of personality and a striking art style. The amount of content present within the game is extraordinary, featuring a plethora of main collectibles, alongside worthwhile side content. Fully completing the game is guaranteed to take a large amount of time, but the variety of turfs to explore will make the quest to defeat the Demon King a memorable one. If you're after another great platformer on Nintendo Switch, then Demon Turf will definitely scratch that itch.",2021-11-03T00:00:00.000Z,True,2ec6541c3d2a49ed869c1edbcd196a2b
618289068412069004c4a320,TechRaptor,James Bentley,80.0,"Demon Turf is a great feeling platformer with some interesting level design, even if its a little inconsistent and a little too long",2021-11-03T00:00:00.000Z,True,2ec6541c3d2a49ed869c1edbcd196a2b
5fce9835038871749d418107,Saving Content,Ed Acosta,80.0,"Watch Dogs Legion is good fun, even if I’m not a big fan of it’s setting. The “Be Anyone” mechanic is a welcome addition to the series and one I would miss if it were not included in future titles. In fact, I think you have to include it in all titles going forward as it’s that fun to have. I do hope they improve on the storytelling and voice modulation for future titles using this feature though.",2020-12-07T00:00:00.000Z,False,972849b01e744bddb496223c8ac5c7b7
5fc17bed038871749d416b17,PlayStation LifeStyle,Chandler Wood,60.0,"What you end up with is an experience that shows a ton of promise, but ends up being entirely average. It's hard to call Watch Dogs Legion a bad game outright. It's a serviceable, if traditional, open-world game with a boring story and novelty mechanics that play out better on paper than in execution. The PS5 version makes expected improvements to visuals and load times, but isn't a standout example of a ""next-gen"" title.",2020-11-27T00:00:00.000Z,True,972849b01e744bddb496223c8ac5c7b7
5fbf8bfc038871749d416907,Rectify Gaming,Ryan Welch,70.0,An ambitious undertaking that is marred by poor writing and bugs.,2020-11-25T00:00:00.000Z,False,972849b01e744bddb496223c8ac5c7b7
5fbe84c0038871749d416840,ZTGD,Anthony Mann,65.0,"My gripes really stem from the place of being a fan. Anyone entering Watch Dogs: Legion looking for a by the books open world game is going to find a lot to enjoy. There are small puzzles to solve, plenty of collectibles, lots of missions and I would say the shooting and driving are the best this series has ever been. Fans of the series like myself however will be disappointed by the lack of enjoyable characters as well as stand out missions and story beats. With how close Legion is releasing to Assassin’s Creed: Valhalla and Immortals Fenyx Rising it feels like Watch Dogs: Legion was left to fight for your attention and your money with less money put into development. I would recommend both Watch Dogs 1 & 2 as well as plenty of other Ubisoft experiences from the last few years before Legion at full price.",2020-11-25T00:00:00.000Z,True,972849b01e744bddb496223c8ac5c7b7
5fbe39c3038871749d41679c,VGChartz,Paul Broussard,40.0,"Watch Dogs: Legion is Ubisoft’s third attempt to make the open world/hacking combination work, and despite containing a few interesting ideas, it falls flat just as quickly as the others.",2020-11-25T00:00:00.000Z,False,972849b01e744bddb496223c8ac5c7b7
624cd87e008489e208d782bb,Post Arcade (National Post),Chad Sapieha,70.0,"Playing (pre-release) on Xbox One we experienced a chuggy frame rate and several crashes, but our experience on Xbox Series X has been smooth as butter. More than that, London rendered on next-generation consoles is pretty as a picture, with beautiful lighting effects that include puddles on its wet roads that perfect reflect the city and its gorgeously overcast sky.",2020-11-24T00:00:00.000Z,True,972849b01e744bddb496223c8ac5c7b7
5fbcf7f6038871749d4165ce,GameGrin,Anna Duncan,65.0,Ubisoft have done well with this game but if you get frustrated easily I would maybe wait till this game has had a few more updates first before playing it.,2020-11-24T00:00:00.000Z,True,972849b01e744bddb496223c8ac5c7b7
5fbbd284038871749d4163ef,PlayStation Universe,Neil Bolt,65.0,"Watch Dogs: Legion is a far more palatable experience on PS5 thanks to its vastly-improved load times and splendid visual upgrades. The only real technical gripes are that there's little in the way of DualSense implementation, and the framerate, while steady, hasn't been upped. Its base problems of open-world fatigue and messy storytelling are still problems that can't be so easily fixed and still remain a significant barrier to enjoyment. It'll give you a dazzling trip to London, but you wouldn't want to stay there.",2020-11-23T00:00:00.000Z,True,972849b01e744bddb496223c8ac5c7b7
5fba828e038871749d4162a1,Impulsegamer,John Werner,100.0,"Set in a plausible alternate future, ""Watch Dogs: Legion"" is the third open-world action-adventure game in the Watch Dogs series, following on from the events of both previous games.",2020-11-22T00:00:00.000Z,True,972849b01e744bddb496223c8ac5c7b7
5fb9147a038871749d416084,Push Square,Liam Croft,50.0,"Watch Dogs Legion might look and run better than ever on PS5, but that means little when the game itself struggles to break the boundaries of mediocrity. This next-gen version remains unchanged from its PS4 counterpart as far as gameplay goes, so the boosted performance does little to hide the title's underlying issues. No matter how well it runs, Watch Dogs Legion needs to sort out how it plays.",2020-11-21T00:00:00.000Z,True,972849b01e744bddb496223c8ac5c7b7
5fb8379a038871749d415f24,Level Down Games,Bryan Clutter,65.0,"Even though it may sound as if the game is avoidable after reading through this review, there’s still some fun to be had, especially for the hardcore Watch Dogs fans if that is such a thing. Going into this, I was craving another Ubisoft style, check-box frenzy of a game, and this just didn’t do it for me in the slightest. It didn’t help that Assassin’s Creed Valhalla released just a handful of days after this and is exactly the style of game we were looking for. So should you jump in? That largely depends on you. If you played the first two games, I can certainly recommend a go at this one just to stay fresh on story elements and be prepared for the hopeful revitalization of the franchise when we get Watch Dogs: Black Flag. For everyone else, you can probably look away this time, especially with so many things releasing right now in the new generation of console gaming.",2020-11-20T00:00:00.000Z,False,972849b01e744bddb496223c8ac5c7b7
5fb70798038871749d415cb8,GamingTrend,David Flynn,75.0,"If your connection is strong enough to reliably stream it, Stadia is a good place to play Watch Dogs: Legion. The technology focused stealth compensates for the input lag nicely, and the game looks and runs far better than my mid to low range desktop could hope to.",2020-11-19T00:00:00.000Z,True,972849b01e744bddb496223c8ac5c7b7
5fc1008f038871749d416a63,Hu3br,Lucas Moura,50.0,"Watch Dogs: Legions should’ve been an interesting game due to its “recruit everyone” nature. But for that to work it needs a city that properly reacts to the players’ actions. Sadly, the dystopian London is nothing but another theme park for you do what you want. It lacks proper context and is too afraid to tell a story that isn’t as safe as possible.",2020-11-18T00:00:00.000Z,False,972849b01e744bddb496223c8ac5c7b7
5fb2dab1038871749d415492,Echo Boomer,David Fialho,60.0,"There's ambition in this new episode, the tech behind the procedural generation of playable NPCs stands out as much as the inclusion of visual features like ray-tracing, but beyond that and the neo-punk aesthetic, Watch Dogs: Legion lacks the substance to get us really hooked.",2020-11-16T00:00:00.000Z,False,972849b01e744bddb496223c8ac5c7b7
5fb27a7e038871749d4153fe,PushStartPlay,Richard Lee Breslin,80.0,"Watch Dogs Legion is one of the most fun, unique and innovative games I’ve played this year.",2020-11-16T00:00:00.000Z,False,972849b01e744bddb496223c8ac5c7b7
5fb224eb038871749d415392,GBAtemp,Pranavsingh Dhunnoo,68.0,"This score represents the experience of the PC version which is, even weeks after launch, in a sorry state of buggy mess for many players. Nevertheless, Watch Dogs: Legion does offer some decent fun overall with its sandbox approach to missions and standout feature of playing as virtually anyone in London.",2020-11-16T00:00:00.000Z,True,972849b01e744bddb496223c8ac5c7b7
615f57259e65de2d02a17ab4,GearNuke,Khurram Imtiaz,80.0,Watch Dogs Legion is an ambitious albeit disappointing successor to Watch Dogs 2. It fails to offer a compelling narrative but the gameplay is still as enjoyable as ever.,2020-11-15T00:00:00.000Z,True,972849b01e744bddb496223c8ac5c7b7
5fae78f2038871749d41507b,Telegraph,Tom Hoggins,60.0,Watch Dogs Legion's innovative 'play as anyone' gimmick gives a fresh twist to the open-world template,2020-11-13T00:00:00.000Z,True,972849b01e744bddb496223c8ac5c7b7
61f0228c9e5c48c548d723d2,The List,Murray Robertson,80.0,"Watch Dogs: Legion is a technically ambitious game which manages to capture the essence of its real-world location, including some of its real-life socio-political battles. Its 'play as anyone' feature isn't quite the game-changer it might appear, but if you've always yearned to recruit a gang of senior citizens to usurp a corrupt political administration from within then Legion can make your dreams come true.",2020-11-12T00:00:00.000Z,False,972849b01e744bddb496223c8ac5c7b7
5facac89038871749d414cb0,Heavy,Jack Fennimore,60.0,"Watch Dogs Legion, like most of Ubisoft’s big budget games, is disposable – a value-sized bag of chips. The gameplay experience is pleasurable and addicting by nature, making you want to play even if you don’t feel like it. And when you get sick of it, you just throw it away.",2020-11-12T00:00:00.000Z,True,972849b01e744bddb496223c8ac5c7b7
