id,company,author,rating,comment,date,top_critic,game_id
5e53f96abdf729557ef416ea,GameSkinny,Gabriel Moss,90.0,"On one hand, Dreams is a bottomless bag filled with toys, vignettes, and indie games. On the other, Dreams is a must-own for anyone who's ever been curious about game design.",2020-02-24T00:00:00.000Z,True,03afbbc03ff14e8cba4427cd0f69d090
61d970649e5c48c548d6ac4b,GameGrin,Artura Dawn,100.0,"Horizon Zero Dawn truly expresses how videogames nowadays are an art form, if not only through its visuals and storytelling, then certainly through its expertly incorporated combat. A glee-filled experience through and through.",2022-01-08T00:00:00.000Z,True,5ce7e46378254948a5eb921ca32cf569
61313f763b0d5cbd8095fe74,TheReviewGeek,Greg Wheeler,90.0,"The quality of the worldbuilding, storytelling and gameplay combine to create a cocktail of heady brilliance; Horizon Zero Dawn is the gold standard for how open world games should be made.",2021-09-02T00:00:00.000Z,False,5ce7e46378254948a5eb921ca32cf569
5d86756093765d6778764c28,Push Square,Sammy Barker,90.0,"Debuts don't get much stronger than Horizon Zero Dawn. Guerrilla Games' latest borrows liberally from a variety of different sources, and yet it leverages these fundamentals to forge an experience that's daringly unique. The main quest tires a little towards the end, and the writing never hits the same highs as The Witcher 3 – but the tactical action stands leagues ahead of what we've come to expect from the genre, and the presentation is quite simply unmatched.",2021-04-19T00:00:00.000Z,True,5ce7e46378254948a5eb921ca32cf569
5d86756993765d6778765123,Daily Star,James Wright,100.0,"Previously we'd have said that Uncharted 4: A Thief's End was unequivocally the greatest game you'd ever see on the PS4. But now, thanks to the extra processing power of PS4 Pro, Horizon Zero Dawn probably edges it. Hell, it even has a fantastic photo mode thrown in just for good measure that can make those breathtaking vistas look all the more impressive.",2019-07-04T04:00:00.000Z,True,5ce7e46378254948a5eb921ca32cf569
5d86756993765d6778765131,Fun Factor,Gonçalo Nolasco,80.0,"Horizon Zero Dawn is an impressive entry this generation. The PS4's capabilities are pushed to its maximum, accompanied by an excellent writing and game design, Guerrilla Games' newest title shines with its gameplay and worldbuilding, even though there's some fixes to be made, especially on quests and the main story. With a sequel probably coming on the PS5, the IP's future looks promising.",2018-12-13T05:00:00.000Z,False,5ce7e46378254948a5eb921ca32cf569
5d86756893765d67787650fb,Ovigami,Ovidio Fuentes,95.0,"Horizon Zero Dawn is one of the most beautiful and dynamic worlds you can currently play in. The merger of the technological and nature is simply incredible. The story doesn’t let you put down your controller. It’s gameplay is fun, diverse and challenging. Great start to a new fantastic franchise.",2017-09-10T04:00:00.000Z,False,5ce7e46378254948a5eb921ca32cf569
5d86756893765d6778765104,The PlayStation Hub,Leif Rey Bornales,100.0,"Overall, Horizon Zero Dawn made me a believer in new and innovative games. It doesn't  mean that a game is new that it cannot be something high-caliber. And Horizon Zero Dawn proved this to me. Playstation and its first-party games have never failed to deliver a blockbuster experience, and Horizon Zero Dawn is up there on that list.",2017-05-03T04:00:00.000Z,False,5ce7e46378254948a5eb921ca32cf569
5d86756893765d6778765101,The Bitbag,Matthew Stephen Gatchalian,85.0,"Horizon Zero Dawn manages to turn all the good qualities from well-known titles into an enjoyable and finely polished experience. However, it doesn’t provide anything new for those burned out from playing triple-A games.",2017-05-03T04:00:00.000Z,False,5ce7e46378254948a5eb921ca32cf569
5d86756893765d6778765107,ani-game.com,Joel Gralton,90.0,Horizon: Zero dawn was an absolute joy to play through and I really hope Guerrilla Games decides to make this their core IP. I want to spend more time in this world even after obtaining the platinum trophy. The core gameplay loop is incredibly addictive. Hopefully a story expansion comes soon just so I can dive back into this world.,2017-05-02T04:00:00.000Z,False,5ce7e46378254948a5eb921ca32cf569
5d86756893765d67787650f0,Tiny Spaceship,David Parker,80.0,"Horizon: Zero Dawn is a triumph with a handful of minor flaws. Exciting combat, an engaging new world to explore, and a likable, confident protagonist combine for a rewarding experience. While I don’t hasten to call this a system seller, I do think that all PS4 owners should give this game a serious look. With such a strong original property, and an exciting fusion of so many quality game elements, it’s clear that Guerrilla Games has a great deal more to offer than reliance on the Killzone series, and I’m excited to see what they’ll be working on next.",2017-05-02T04:00:00.000Z,False,5ce7e46378254948a5eb921ca32cf569
5d86756893765d67787650d7,CDavis_Games,Chris Davis,100.0,"Horizon Zero Dawn hits the trifecta. Incredible combat, story, and characters. It’s also polished and doesn’t outstay it’s welcome. I can’t imagine I’ll play it again anytime soon, but the fifty hours I spent with Horizon were some of the best I’ve ever had.",2017-04-15T04:00:00.000Z,False,5ce7e46378254948a5eb921ca32cf569
5d86756993765d6778765125,pressakey.com,Darius Kubisch,100.0,"Horizon: Zero Dawn convinces with a fresh scenario with an interesting story and the fantastically staged battles against machines. In addition, Aloy is a new hero and the bombastic graphics of the Decima engine will enchant you throughout the entire game. Gladly more of it.",2017-04-11T04:00:00.000Z,False,5ce7e46378254948a5eb921ca32cf569
5d86756793765d67787650c4,Gaming Tree House,Nicholas Catto,95.0,"Guerilla Games has outdone themselves with Horizon: Zero Dawn. Whether you’re enjoying the lush, vibrant open world setting, or soaking in every moment of the story, you’ll never stop being entertained. The combat is deep and intuitive, even with the minor glitches I encountered. Aloy adds a strong new character to Sonys already deep roster.",2017-04-08T04:00:00.000Z,False,5ce7e46378254948a5eb921ca32cf569
5d86756793765d67787650c1,Rectify Gaming,Daniel Brennan,95.0,Horizon Zero Dawn is nothing short of a masterpiece.,2017-03-30T04:00:00.000Z,False,5ce7e46378254948a5eb921ca32cf569
5d86756793765d67787650b8,Level Down Games,Bryan Clutter,100.0,"Horizon Zero Dawn is a game that almost every owner of the PlayStation 4 should experience sooner or later. It doesn’t just appeal to roleplaying game fans or action adventure enthusiasts. This is a game that almost everyone can enjoy in some fashion, and it shows with how well the game has been performing since it’s release one month ago. This is an impressive piece of art for both Sony and Guerrilla Games, and we simply cannot wait to see what is coming next.",2017-03-30T04:00:00.000Z,False,5ce7e46378254948a5eb921ca32cf569
5d86756793765d67787650be,Game Volt,Mohamed Ashmawy,90.0,"Horizon Zero Dawn is a new Benchmark for Sony's Exclusives, we have a new Face for Sony Games which is Aloy, and just Like Nathan Drake and Kratos also Joel and Ellie she is gonna be the new hero for PlayStation Brand, The Game Beautiful Design isn't only the main selling point but the incredible work Guerrilla Studio did with bringing new IP Different than Killzone with great quality is the real surprise",2017-03-26T04:00:00.000Z,True,5ce7e46378254948a5eb921ca32cf569
5d86756693765d677876508e,ThisGenGaming,Justin Oneil,100.0,Horizon: Zero Dawn is a testament to the hard work and passion of every individual at Guerrilla Games.,2017-03-25T04:00:00.000Z,True,5ce7e46378254948a5eb921ca32cf569
5d86756693765d6778765093,TechRaptor,Andrew Otton,90.0,Horizon Zero Dawn is great game design wrapped up in one of the best AAA packages put out to date.,2017-03-24T04:00:00.000Z,True,5ce7e46378254948a5eb921ca32cf569
5d86756893765d67787650e7,Fuzzy Pixels,Matt Gardner,88.0,"<iframe src=""https://www.youtube.com/embed/L5V0BTRtLRc"" frameborder=""0"" allowfullscreen></iframe>

Horizon Zero Dawn is a brilliant, beautiful and bold action-adventure. With this expansive and ambitious game, Guerrilla finally have a masterpiece to their name, and, in Aloy, a PlayStation legend in the making.",2017-03-22T04:00:00.000Z,False,5ce7e46378254948a5eb921ca32cf569
5d86756893765d67787650e4,Spaziogames,Domenico Musicò,90.0,"Horizon Zero Dawn is one of the best open world games of this generation, a really solid experience and a great piece of work from Guerrilla.",2017-03-22T04:00:00.000Z,True,5ce7e46378254948a5eb921ca32cf569
5d86756793765d677876509f,ComiConverse,Dan Goad,100.0,"Horizon Zero Dawn is one of the best games of this generation. Whilst it borrows elements from other games, it melds them into a seamless experience that sets a new bar for open world games.",2017-03-22T04:00:00.000Z,True,5ce7e46378254948a5eb921ca32cf569
5d86756793765d67787650ae,Marooners' Rock,Josh Pedroza,94.0,"Considering this is Guerrilla Games' first open-world title, I must say I’m impressed with what they gave us. Using the full potential of the Decima engine, Guerilla Games was able to show the true power of the Playstation 4.",2017-03-22T00:00:00.000Z,False,5ce7e46378254948a5eb921ca32cf569
5d86756793765d67787650cc,SmashPad,Alex Quevedo,90.0,"There was a point while playing through Horizon: Zero Dawn where I questioned how much longer I needed to be at social events because, you know, time in Aloy’s shoes. Or, rather, I skipped out on events entirely so I can play the game. Other times, it was that “well, I could do just one more quest…” feeling. Early on, that’s how I knew this game was worth it. It sucks you in for all the right reasons but won’t overly dominate your life like some other games can (I didn’t cancel that many plans, thank you).",2017-03-21T04:00:00.000Z,False,5ce7e46378254948a5eb921ca32cf569
5d86756793765d677876509c,Super Deformed Gamescast,Matthew Finneman,90.0,"A shining example of how to debut a new IP, Horizon: Zero Dawn comes out swinging and doesn’t let you go until the credits roll. Deep, customizable combat perfectly complements the engaging story.",2017-03-21T04:00:00.000Z,False,5ce7e46378254948a5eb921ca32cf569
5d86756693765d6778765047,Pause Resume,Alexandra Collinson,80.0,"All in all Horizon is a fun game, there is loads of content and the story is engaging. However, there is a lack of personality in the side missions as they all follow the same tropes and become slightly boring. The best thing about Horizon is the world in which you play.",2017-03-20T04:00:00.000Z,False,5ce7e46378254948a5eb921ca32cf569
5d86756893765d67787650f3,Click Click Play,Jordan Rees,90.0,"Putting a few very minor (and no doubt subjective) niggles aside – I’d argue that Horizon is an unreserved triumph, and a watershed moment for this generation of consoles in terms of maturing the medium. As Nathan Drake settles into a potentially permanent retirement, Sony has done well to pass on the baton. Whether or not we see Aloy again (and I have a strong suspicion that we will…) – Horizon is, thankfully, here to stay.",2017-03-18T04:00:00.000Z,False,5ce7e46378254948a5eb921ca32cf569
5d86756893765d67787650d4,TeamNerd,Enrico Pusceddu,90.0,"We strongly recommend Horizon Zero Dawn to all of our readers. PlayStation4 may be content with this title, which greatly affects the number of previews that it continues to collect with great care and dedication.",2017-03-16T04:00:00.000Z,False,5ce7e46378254948a5eb921ca32cf569
5d86756693765d677876504a,RPG Fan,Nicholas Ransbottom,88.0,"Horizon Zero Dawn isn't without its issues, but it's a thoroughly enjoyable game that belongs in every PS4 owner's library.",2017-03-16T04:00:00.000Z,True,5ce7e46378254948a5eb921ca32cf569
5d86756893765d67787650dd,Games Xtreme,Anthony Preece,100.0,"Horizon: Zero Dawn is one of those rare games that actually feels like a AAA title. The level of polish and care that has gone into the game echoes throughout. It's an incredible journey worth undertaking, worth every moment you spend with the game.",2017-03-15T04:00:00.000Z,False,5ce7e46378254948a5eb921ca32cf569
5d86756693765d677876503b,Geeks Under Grace,Damien Chambers,98.0,"Every decade or so, a game comes along that sets a new high bar of achievement in the industry. These games stand the test of time and delight audiences for years to come, even if they never receive the sequel they deserve. Horizon: Zero Dawn is one of these games and it has rightly earned its place among the pantheon of some of the greatest games of all time.",2017-03-15T04:00:00.000Z,False,5ce7e46378254948a5eb921ca32cf569
5d86756993765d6778765120,PowerUp!,Leo Stevenson,95.0,"Horizon is a better game than BotW and while maybe not as ‘important,’ Horizon is the game that will have a lasting, personal impression.",2017-03-13T04:00:00.000Z,False,5ce7e46378254948a5eb921ca32cf569
5d86756693765d6778765091,Wccftech,Chris Wray,95.0,"Horizon Zero Dawn is a pure sign of what can be completed with an exceptionally designed open world. Not only that, it has exceptional characterisation and a sincere story that doesn't shoehorn elements, allowing for the organic growth of characters. This is a game that I can barely find any faults with, except borrowing some elements from other open world games. Even so, it made each and every element its own in one of the best games to date.",2017-03-12T05:00:00.000Z,True,5ce7e46378254948a5eb921ca32cf569
5d86756593765d6778764fec,Cubed3,Drew Hurley,90.0,"There are exclusive titles on every console that epitomise the system; titles that are indelibly linked with that hardware through future generations. Adventures like The Last of Us, like Kingdom Hearts, like GoldenEye and Super Mario 64. Horizon: Zero Dawn stands worthily alongside these iconic releases. The story is enthralling, the open world is lush and inviting, the gameplay extremely addictive, and the sheer scale of it all is amazingly vast. Simply put, this is a phenomenal game.",2017-03-12T05:00:00.000Z,True,5ce7e46378254948a5eb921ca32cf569
5d86756593765d6778764fe3,Impulsegamer,James Wright (Impulsegamer),96.0,"There’s been much hype surrounding Horizon Zero Dawn and thankfully it has delivered in more ways than one. It boasts a very likeable and interesting protagonist and the story behind Horizon Zero Dawn is one that is filled with mystery and intrigue. Of course, it’s all about the gameplay and Guerrilla should be commended in creating such a fluid and dynamic game as you explore this post-apocalyptic world 1000 years in the future that is filled with different cultures and even history which seems so real. Combat is fun and the missions are diverse and at the end of the day, Horizon Zero Dawn is a title that really raises the benchmark on the PlayStation 4.",2017-03-11T05:00:00.000Z,True,5ce7e46378254948a5eb921ca32cf569
5d86756893765d67787650f8,Words About Games,Gary Alexander,80.0,Horizon: Zero Dawn is an excellent robot hunting game. When you’re in the thick of fighting one of its fantastic robotic opponents it feels like one of the best games you’ve played all year.,2017-03-10T05:00:00.000Z,False,5ce7e46378254948a5eb921ca32cf569
62b410770bfe2deada18569f,GamesHub,Chris Button,100.0,"Rogue Legacy 2 is the perfect sequel. It retains the core of what made the original fantastic, with every feature adding tremendously to the experience. Its cleverly revised class system adds near-limitless gameplay variety, which makes each attempt fun – even when you fail abysmally. This game is everything I wanted from the follow-up, and then some.",2022-06-23T00:00:00.000Z,False,e343cee48e8e4cca80b0ae3d228342aa
629a652e0bfe2deada17c13d,DarkZero,Jorge S Fernandez,80.0,"In conclusion, while Rogue Legacy 2 is more of a refinement than a revolution, it nonetheless stands out as another must-have Roguelike, which is impressive given the ever-increasing supply of quality titles in the genre. Even if the plate is currently full, this is another tasty dish that is worth savoring when the craving comes calling again.",2022-06-03T00:00:00.000Z,True,e343cee48e8e4cca80b0ae3d228342aa
62977f130bfe2deada17b1ad,ZTGD,Drew Leachman,95.0,"Rogue Legacy 2 is a fantastic game. It takes everything I loved about the first game, refines it, adds way more content, and keeps the gameplay just as tight and smooth. It’s a rogue-like that even non-fans of rogue-likes can warm up to. If you played the first game, this is a no-brainer. Even if you haven’t, you’ll have a great time here with a game jam-packed with content. I cannot suggest this one enough.",2022-06-01T00:00:00.000Z,True,e343cee48e8e4cca80b0ae3d228342aa
62b832e70bfe2deada186f03,Oyungezer Online,Eser Güven,90.0,"This is the prime version of Rogue Legacy series; better, bigger and badder! Impossible not to fall in love with it.",2022-05-25T00:00:00.000Z,True,e343cee48e8e4cca80b0ae3d228342aa
629d96940bfe2deada17c954,Hey Poor Player,Andrew Thornton,90.0,"Rogue Legacy 2 offers so many options when it comes to classes, upgrades, and ways to play it that anyone remotely open to the roguelite genre should check it out. I might have asked for a bit more direction in how to approach certain upgrade paths since the volume of choices can be borderline overwhelming, but it’s a minor quibble when everything else about the game is so fantastic. Rogue Legacy 2’s memorable world and overflowing personality will keep you invested until the very end.",2022-05-25T00:00:00.000Z,False,e343cee48e8e4cca80b0ae3d228342aa
628b84b40bfe2deada1761eb,WayTooManyGames,Oliver Shellding,100.0,"Rogue Legacy 2 is a masterwork in taking something already great and elevating it without getting lost in ambition and abandoning the core interest. It’s Mega Man 2. It’s LeChuck’s Revenge. It’s freaking Super Smash Bros. Melee. This is the way all sequels should be, and I’m ecstatic to finish my review so I can go back and play it again.",2022-05-23T00:00:00.000Z,False,e343cee48e8e4cca80b0ae3d228342aa
6281f7f2008489e208d91606,AusGamers,Kosta Andreadis,80.0,"The flip-side to this is a positive, in that Rogue Legacy’s intricate progression and many, many secrets to discover is enough to warrant on and off play for weeks and months. If you’re after a pure rogue-lite experience and something that has the combat depth and platforming challenge to keep you hooked on its loop for an extended period, then Rogue Legacy 2 is a resounding success. Visually, it's a huge leap forward over the original too - with some fantastic animation and responsive 2D action.",2022-05-16T00:00:00.000Z,True,e343cee48e8e4cca80b0ae3d228342aa
627d67cb008489e208d9080e,GameSkinny,Nathan Gibson,90.0,"Rogue Legacy 2 is a worthy sequel that improves upon almost every aspect of the original, adding a wide array of new classes, abilities, and content.",2022-05-12T00:00:00.000Z,True,e343cee48e8e4cca80b0ae3d228342aa
627c4ae0008489e208d900b0,Game Informer,John Carson,90.0,"Despite my nitpicks, every new discovery unveiled, skills obtained, and boss defeated wipes away any grief and replaces it with deep satisfaction. There’s a lot to clean up with the core progression systems to make the ramp from beginning to end escalate more evenly, but I’ve enjoyed most of my hours struggling through countless generations of my goofy little bloodline. I am overjoyed the entertaining heritage of this series remains firmly intact.",2022-05-11T00:00:00.000Z,True,e343cee48e8e4cca80b0ae3d228342aa
627bc7e0008489e208d8fb1a,COGconnected,Mark Steighner,90.0,"Rogue Legacy essentially spawned the roguelite genre and nine years later, its sequel improves the recipe in every way. Rogue Legacy 2 looks fantastic and plays even better, with engaging mechanics and an addictive gameplay loop. While you might not always make progress, you also never feel bored or that the game disrespects your time. Every run is a new experience and often surprising. There are a lot of systems at play, but they generally help Rogue Legacy 2 transcend the limits of the genre and make it endlessly replayable and entertaining.",2022-05-11T00:00:00.000Z,True,e343cee48e8e4cca80b0ae3d228342aa
62a09dac0bfe2deada17dba8,GamingBolt,Ravi Sinha,90.0,"Rogue Legacy 2 is an excellent step up from its predecessor, adding tons of new, fun content along with heaps of systems for even more varied runs. Though it can be grindy and somewhat difficult, the enjoyable gameplay will keep you coming back.",2022-05-09T00:00:00.000Z,True,e343cee48e8e4cca80b0ae3d228342aa
6279e9aa008489e208d8eb6e,Video Chums,A.J. Maciejewski,92.0,Rogue Legacy 2 is simply one of the best indie games ever. It manages to stay true to the original while forging its own identity in ways that make it stand out as unique and ultimately superior. You'd be a complete goof if you don't enjoy every second of it.,2022-05-09T00:00:00.000Z,True,e343cee48e8e4cca80b0ae3d228342aa
627919d0008489e208d8e426,Saving Content,Ed Acosta,100.0,"Rogue Legacy 2 has entangled me in its grind. It has cracked that code in me where others often get it wrong. Thanks to the randomness of the heroes, the ability to carry over progression, and the fun combat, I have that urge to keep playing. Rogue Legacy 2 will easily sit in my top games of this year and possibly be one of the most fun times I’ve had this year.",2022-05-09T00:00:00.000Z,False,e343cee48e8e4cca80b0ae3d228342aa
62790cfd008489e208d8e400,MondoXbox,Győző Baki,87.0,"Rogue Legacy 2 doesn't revolutionize the saga but expands and improves every part of it, adding great variety and many options for the players. This will keep it a constant presence in your hard drives for many months.",2022-05-09T00:00:00.000Z,False,e343cee48e8e4cca80b0ae3d228342aa
627831d9008489e208d8e23a,GameBlast,Ivanir Ignacchitti,100.0,"Rogue Legacy 2 is a perfect example of what action roguelikes can offer. With robust gameplay systems and a proposal that does not use procedural generation as a crutch, it is simply a must-see.",2022-05-07T00:00:00.000Z,False,e343cee48e8e4cca80b0ae3d228342aa
6276a4cc008489e208d8ded0,NoobFeed,Linden Garcia,90.0,"Rogue Legacy 2 is built to be played for hours at a time or for ten minutes; it’s welcoming to Rouge-like newbies and PC veterans; It’s uncomplicated yet with a suitable amount of depth. Cellar Door Games have undoubtedly outdone themselves again, setting a new bar for the Rogue-lite gameplay style they helped kickstart.",2022-05-07T00:00:00.000Z,False,e343cee48e8e4cca80b0ae3d228342aa
6279f2d3008489e208d8eb8e,INVEN,Suhyung Jung,88.0,"Rogue Legacy2 shows a perfect combination of Rogue-lite and Metrovania. the game is enjoyable for hundreds of hours thanks to both genres compensate each other's downside.  While, the improved exploring and battle systems added the completeness to the previous title, similar gameplay styles and monster designs can make you feel somewhat dull.",2022-05-06T00:00:00.000Z,True,e343cee48e8e4cca80b0ae3d228342aa
62758d40008489e208d8dbf9,Chalgyr's Game Room,Nick Herber,87.5,"Rogue Legacy 2 is a delightful mix of action-platforming with enough progression elements baked in to keep the many deaths from getting too frustrating. Unlocking new areas of my tower or discovering new traits was enjoyable, as was trying out new class / weapon / ability combinations with each new generation.

Rogue Legacy 2 is a worthy successor to its ancestor.",2022-05-06T00:00:00.000Z,False,e343cee48e8e4cca80b0ae3d228342aa
62753d35008489e208d8d9c2,LadiesGamers.com,James Luff,100.0,"While I did manage to find a few things to nitpick there is no denying I kept coming back to this game run after run. The random generation of the character types and level design is so enormous that every attempt at taking down the castle felt different. On top of that, the controls are tight and easy to use and the game is overall enormous fun to play. Rogue Legacy 2 is everything I loved about the original title with so much more added to it. Unless you absolutely hate the rogue-lite genre there is plenty of incentive to jump into the sequel thanks to its accessibility features and general refinements to the gameplay. Even years from now Rogue Legacy 2 is sure to solidify itself as one of the best in the rogue-lite genre. Well at least until the next game that is.",2022-05-06T00:00:00.000Z,False,e343cee48e8e4cca80b0ae3d228342aa
62cbe7580bfe2deada190c86,GamingINTEL,Daniel Medina,80.0,Rogue Legacy 2 builds upon everything Rogue Legacy established and improves on it in every way. Its addictive gameplay and beautiful world-building are enough to make it one of our favorite games of the year.,2022-05-04T00:00:00.000Z,False,e343cee48e8e4cca80b0ae3d228342aa
628e7dfb0bfe2deada1782e3,NaviGames,Adrián Kemuél,90.0,"Rogue Legacy 2 has followed in the footsteps of its predecessor, taken everything that made it great and built a fun and unforgettable experience.",2022-05-04T00:00:00.000Z,False,e343cee48e8e4cca80b0ae3d228342aa
62729678008489e208d8bdd0,PC Gamer,Anne Marie Coyle ,88.0,A sublime addition to the Rogue Legacy family and one of the best rougelites yet.,2022-05-04T00:00:00.000Z,True,e343cee48e8e4cca80b0ae3d228342aa
62748147008489e208d8d35d,Geek Culture,Jake Su,90.0,"A stupendous continuation of the legacy of Cellar Door Games, Rogue Legacy 2 is everything you would want in a sequel, and then some.",2022-05-03T00:00:00.000Z,False,e343cee48e8e4cca80b0ae3d228342aa
